{
  "schema_version": "perception.v1",
  "trip_id": "T01d",
  "frame_id": 419,
  "timestamp": 20.95,
  "status": "degraded",
  "objects": [],
  "min_ttc_sec": null,
  "risk_level": "UNKNOWN",
  "perception_quality": 0.2,
  "latency_ms": 18.1,
  "degraded_reasons": ["right_camera_unavailable", "stereo_depth_unavailable"]
}

